{
  "creators": [
    {
      "name": "Arnold, Frederik",
      "affiliation": [
        {
          "name": "Institut für Bibliotheks- und Informationswissenschaft"
        }
      ]
    }
  ],
  "titles": [
    {
      "title": "Verfahren zur Entdeckung und Charakterisierung von im Projekt Schlüsselstellen in der Literatur Was ist wichtig? – Schlüsselstellen in der Literatur"
    }
  ],
  "posterContent": {
    "sections": [
      {
        "sectionTitle": "Abstract",
        "sectionContent": "Verfahren zur Entdeckung und Charakterisierung von im Projekt Schlüsselstellen in der Literatur Was ist wichtig? – Schlüsselstellen in der Literatur"
      },
      {
        "sectionTitle": "Introduction",
        "sectionContent": "Erkennung wörtlicher Zitate"
      },
      {
        "sectionTitle": "Methods",
        "sectionContent": "Text 1\n0 w1 w2 w3 w4 w5 w6 w7\n7 w8 w9 w10 w11 w12 w13 w14\n14 w15 w16 w17 w18 w19 w20 w21\n21 w22 w23 w24 w25 w26 w27 w28\n28 w29 w30 w31 w32 w33 w34 w35\n35 w10 w11 w12 w13 w14 w15 w16\nText 2\n50 … … … … … … … …\n60 w17 w18 w19 w20 w21 w22 …\n75 w8 w9 w10 w11 w12 …\n90 … … … … … … … …\n120 w8 w9 w10 w11 w12 …\n130 w27 w28 w29 … w33 w34 w35"
      },
      {
        "sectionTitle": "Materials and Methods",
        "sectionContent": "Korpus\n- erstellt im ArguLit- Projekt3\n- 45 Interpretationstexte der Judenbuche\n- 52 Interpretationstexte des Michael Kohlhaas\nSegmentierung\nZitierte Stellen aus Interpretationstexten\nw1 w2 w3 w4 w5 w6 w7 w8 w9 w10\nw3 w4 w5 w6 w7 w8 w9\nw2 w3 w4\nw1 w2 w3\nw8 w9 w10"
      },
      {
        "sectionTitle": "Results",
        "sectionContent": "Comic\nhttps://kiid.com/1262 (Stand: 12.03.2021)"
      },
      {
        "sectionTitle": "Key Findings",
        "sectionContent": "Auswertung\n45 Interpretationstexte der Judenbuche\nPrecision: 0.80 Recall: 0.91 F-score: 0.85"
      },
      {
        "sectionTitle": "Discussion",
        "sectionContent": "Weitere Schritte\n• Tokenisierung\n• ä, ö, ü etc. vereinheitlichen\n• Satzzeichen markieren oder entfernen\n• Fuzzy matching\n• Matches zusammenfassen\n• Zu kurze Matches entfernen\n• Satzgrenzen berücksichtigen"
      },
      {
        "sectionTitle": "References",
        "sectionContent": "Quellen\n• \"sim_text\" von Dick Grune1\n• Similarity texter: A text-comparison web tool based on the \"sim_text\" algorithm von Sofia Kalaidopoulou (2016)2\n• Programmiersprache: Python\n1 https://dickgrune.com/Programs/similarity_tester/\n2 https://people.f4.haw-berlin.de/webervu/ simtext/522789_Sofia-Kalaidopoulou_ bachelor-thesis.pdf (Stand: 12.03.2021)"
      },
      {
        "sectionTitle": "Acknowledgements",
        "sectionContent": "Visualisierungswebseite\nHeatmap\nAnnette von Droste-Hülshoff: Die Judenbuche"
      },
      {
        "sectionTitle": "Contact",
        "sectionContent": "Literatur\nAusgewählte Textstelle\nLiteratur\nHäufig zitierte Stellen\nInterpretationstexte, die die ausgewählte Textstelle zitieren\nInspiriert von: To Quote or Not to Quote (https://shakespeare.visualizingbroadway.com/index.html (Stand: 12.03.2021))"
      }
    ]
  },
  "imageCaption": [
    {
      "caption1": "Comic: https://kiid.com/1262 (Stand: 12.03.2021)",
      "caption2": ""
    }
  ],
  "tableCaption": [
    {
      "caption1": "Literatur\nw1 | w2 | w3 | w4 | w5 w6 w7 | w8 w9 | w10\n2 | 3 | 4 | 3 | 2 | 3 | 2",
      "caption2": ""
    }
  ],
  "$schema": "https://posters.science/schema/v0.1/poster_schema.json"
}